{
  "$schema": "./REQUIREMENT_TRACEABILITY.schema.json",
  "schemaVersion": 1,
  "sourceRequirementLedger": "../product/PRD.md",
  "closedWorld": true,
  "expectedRequirementCount": 68,
  "requirements": {
    "INF-P0-DIAGRAM-001": { "requirementKind": "FEATURE", "productPhase": "P0", "owner": "Core.IsolatedRender", "engineeringPhases": ["T0", "T2", "T3"], "evidenceRefs": ["docs/engineering/RENDER_HELPER_ISOLATION_ADR.md", "docs/engineering/RENDER_MANIFEST.md"], "fixtureGroup": "p0.diagram.offline-render.v1", "evidenceStatus": "OPEN" },
    "INF-P0-DOD-001": { "requirementKind": "DOD", "productPhase": "P0", "owner": "Quality.ReleaseAcceptance", "engineeringPhases": ["T3"], "evidenceRefs": ["docs/engineering/TECHNICAL_DESIGN.md", "docs/engineering/PERFORMANCE_MANIFEST.json"], "fixtureGroup": "p0.dod.offline-end-to-end.v1", "evidenceStatus": "OPEN" },
    "INF-P0-DOD-002": { "requirementKind": "DOD", "productPhase": "P0", "owner": "Core.EditorShell", "engineeringPhases": ["T1", "T3"], "evidenceRefs": ["docs/engineering/TECHNICAL_DESIGN.md", "docs/engineering/SETTINGS_SCHEMA.json"], "fixtureGroup": "p0.dod.keyboard-routing.v1", "evidenceStatus": "OPEN" },
    "INF-P0-DOD-003": { "requirementKind": "DOD", "productPhase": "P0", "owner": "Core.MarkdownPipeline", "engineeringPhases": ["T0", "T2", "T3"], "evidenceRefs": ["docs/engineering/MARKDOWN_DIALECT_MANIFEST.md", "docs/engineering/RENDER_MANIFEST.md"], "fixtureGroup": "p0.dod.markdown-elements.v1", "evidenceStatus": "OPEN" },
    "INF-P0-DOD-004": { "requirementKind": "DOD", "productPhase": "P0", "owner": "Core.IsolatedRender", "engineeringPhases": ["T0", "T2", "T3"], "evidenceRefs": ["docs/engineering/RENDER_HELPER_ISOLATION_ADR.md", "docs/engineering/RENDER_MANIFEST.md"], "fixtureGroup": "p0.dod.diagram-math-offline.v1", "evidenceStatus": "OPEN" },
    "INF-P0-DOD-005": { "requirementKind": "DOD", "productPhase": "P0", "owner": "Core.Navigation", "engineeringPhases": ["T0", "T2", "T3"], "evidenceRefs": ["docs/engineering/SANITIZER_MANIFEST.md", "docs/engineering/TECHNICAL_DESIGN.md"], "fixtureGroup": "p0.dod.heading-fragment-oracle.v1", "evidenceStatus": "OPEN" },
    "INF-P0-DOD-006": { "requirementKind": "DOD", "productPhase": "P0", "owner": "Core.Navigation", "engineeringPhases": ["T2", "T3"], "evidenceRefs": ["docs/engineering/TECHNICAL_DESIGN.md", "docs/engineering/PERFORMANCE_MANIFEST.json"], "fixtureGroup": "p0.dod.scroll-sync-arbitration.v1", "evidenceStatus": "OPEN" },
    "INF-P0-DOD-007": { "requirementKind": "DOD", "productPhase": "P0", "owner": "Core.Recovery", "engineeringPhases": ["T0", "T1", "T3"], "evidenceRefs": ["docs/engineering/SAVE_RECOVERY_ADR.md", "docs/engineering/RECOVERY_JOURNAL_EVENT.schema.json"], "fixtureGroup": "p0.dod.recovery-rpo.v1", "evidenceStatus": "OPEN" },
    "INF-P0-DOD-008": { "requirementKind": "DOD", "productPhase": "P0", "owner": "Core.Recovery", "engineeringPhases": ["T0", "T1", "T3"], "evidenceRefs": ["docs/engineering/SAVE_RECOVERY_ADR.md", "docs/engineering/DATA_PROTECTION_POLICY.md"], "fixtureGroup": "p0.dod.save-recovery-faults.v1", "evidenceStatus": "OPEN" },
    "INF-P0-DOD-009": { "requirementKind": "DOD", "productPhase": "P0", "owner": "Core.DocumentLifecycle", "engineeringPhases": ["T0", "T1", "T3"], "evidenceRefs": ["docs/engineering/SAVE_RECOVERY_ADR.md", "docs/engineering/TECHNICAL_DESIGN.md"], "fixtureGroup": "p0.dod.external-base-adoption.v1", "evidenceStatus": "OPEN" },
    "INF-P0-DOD-010": { "requirementKind": "DOD", "productPhase": "P0", "owner": "Core.Export", "engineeringPhases": ["T0", "T2", "T3"], "evidenceRefs": ["docs/engineering/PDF_PATH_ADR.md", "docs/engineering/TECHNICAL_DESIGN.md"], "fixtureGroup": "p0.dod.exact-version-export.v1", "evidenceStatus": "OPEN" },
    "INF-P0-DOD-011": { "requirementKind": "DOD", "productPhase": "P0", "owner": "Platform.Performance", "engineeringPhases": ["T0", "T3"], "evidenceRefs": ["docs/engineering/PERFORMANCE_MANIFEST.json", "docs/engineering/TECHNICAL_DESIGN.md"], "fixtureGroup": "p0.dod.performance-baseline.v1", "evidenceStatus": "OPEN" },
    "INF-P0-DOD-012": { "requirementKind": "DOD", "productPhase": "P0", "owner": "Platform.Accessibility", "engineeringPhases": ["T1", "T3"], "evidenceRefs": ["docs/engineering/TECHNICAL_DESIGN.md"], "fixtureGroup": "p0.dod.voiceover-critical-path.v1", "evidenceStatus": "OPEN" },
    "INF-P0-DOD-013": { "requirementKind": "DOD", "productPhase": "P0", "owner": "Core.Settings", "engineeringPhases": ["T1", "T3"], "evidenceRefs": ["docs/engineering/SETTINGS_SCHEMA.json", "docs/engineering/SETTINGS_SCHEMA.md"], "fixtureGroup": "p0.dod.settings-contract.v1", "evidenceStatus": "OPEN" },
    "INF-P0-DOD-014": { "requirementKind": "DOD", "productPhase": "P0", "owner": "Core.Navigation", "engineeringPhases": ["T0", "T2", "T3"], "evidenceRefs": ["docs/engineering/SANITIZER_MANIFEST.md", "docs/engineering/TECHNICAL_DESIGN.md"], "fixtureGroup": "p0.dod.secure-local-navigation.v1", "evidenceStatus": "OPEN" },
    "INF-P0-DOD-015": { "requirementKind": "DOD", "productPhase": "P0", "owner": "Core.Recovery", "engineeringPhases": ["T0", "T1", "T3"], "evidenceRefs": ["docs/engineering/SAVE_RECOVERY_ADR.md", "docs/engineering/RECOVERY_JOURNAL_EVENT.schema.json"], "fixtureGroup": "p0.dod.close-autosave-matrix.v1", "evidenceStatus": "OPEN" },
    "INF-P0-DOD-016": { "requirementKind": "DOD", "productPhase": "P0", "owner": "Core.DocumentLifecycle", "engineeringPhases": ["T1", "T3"], "evidenceRefs": ["docs/engineering/TECHNICAL_DESIGN.md", "docs/engineering/SAVE_RECOVERY_ADR.md"], "fixtureGroup": "p0.dod.encoding-line-endings.v1", "evidenceStatus": "OPEN" },
    "INF-P0-DOD-017": { "requirementKind": "DOD", "productPhase": "P0", "owner": "Core.DocumentLifecycle", "engineeringPhases": ["T0", "T1", "T3"], "evidenceRefs": ["docs/engineering/SAVE_RECOVERY_ADR.md", "docs/engineering/TECHNICAL_DESIGN.md"], "fixtureGroup": "p0.dod.external-conflict-delete.v1", "evidenceStatus": "OPEN" },
    "INF-P0-DOD-018": { "requirementKind": "DOD", "productPhase": "P0", "owner": "Core.DocumentLifecycle", "engineeringPhases": ["T0", "T1", "T3"], "evidenceRefs": ["docs/engineering/SAVE_RECOVERY_ADR.md", "docs/engineering/TECHNICAL_DESIGN.md"], "fixtureGroup": "p0.dod.save-as-races.v1", "evidenceStatus": "OPEN" },
    "INF-P0-DOD-019": { "requirementKind": "DOD", "productPhase": "P0", "owner": "Core.Export", "engineeringPhases": ["T0", "T2", "T3"], "evidenceRefs": ["docs/engineering/PDF_PATH_ADR.md", "docs/engineering/SANITIZER_MANIFEST.md"], "fixtureGroup": "p0.dod.export-negative-postflight.v1", "evidenceStatus": "OPEN" },
    "INF-P0-DOD-020": { "requirementKind": "DOD", "productPhase": "P0", "owner": "Quality.ReleaseGovernance", "engineeringPhases": ["T0", "T3"], "evidenceRefs": ["docs/engineering/MARKDOWN_DIALECT_MANIFEST.md", "docs/engineering/RENDER_HELPER_ISOLATION_ADR.md", "docs/engineering/PDF_PATH_ADR.md"], "fixtureGroup": "p0.dod.t0-decision-gates.v1", "evidenceStatus": "OPEN" },
    "INF-P0-DOD-021": { "requirementKind": "DOD", "productPhase": "P0", "owner": "Platform.Release", "engineeringPhases": ["T3"], "evidenceRefs": ["docs/engineering/TECHNICAL_DESIGN.md", "docs/engineering/RELEASE_MANIFEST.schema.json"], "fixtureGroup": "p0.dod.document-registration.v1", "evidenceStatus": "OPEN" },
    "INF-P0-DOD-022": { "requirementKind": "DOD", "productPhase": "P0", "owner": "Quality.VisualRegression", "engineeringPhases": ["T2", "T3"], "evidenceRefs": ["docs/engineering/RENDER_MANIFEST.md", "docs/engineering/RENDER_MANIFEST.schema.json"], "fixtureGroup": "p0.dod.golden-environment.v1", "evidenceStatus": "OPEN" },
    "INF-P0-DOD-023": { "requirementKind": "DOD", "productPhase": "P0", "owner": "Security.SupplyChain", "engineeringPhases": ["T3"], "evidenceRefs": ["docs/engineering/RELEASE_MANIFEST.schema.json", "docs/engineering/TECHNICAL_DESIGN.md"], "fixtureGroup": "p0.dod.release-supply-chain.v1", "evidenceStatus": "OPEN" },
    "INF-P0-EDIT-001": { "requirementKind": "FEATURE", "productPhase": "P0", "owner": "Core.Editor", "engineeringPhases": ["T1", "T3"], "evidenceRefs": ["docs/engineering/TECHNICAL_DESIGN.md"], "fixtureGroup": "p0.edit.core-operations.v1", "evidenceStatus": "OPEN" },
    "INF-P0-EXPORT-001": { "requirementKind": "FEATURE", "productPhase": "P0", "owner": "Core.Export", "engineeringPhases": ["T0", "T2", "T3"], "evidenceRefs": ["docs/engineering/PDF_PATH_ADR.md", "docs/engineering/SANITIZER_MANIFEST.md"], "fixtureGroup": "p0.export.html-pdf.v1", "evidenceStatus": "OPEN" },
    "INF-P0-FILE-001": { "requirementKind": "FEATURE", "productPhase": "P0", "owner": "Core.DocumentLifecycle", "engineeringPhases": ["T0", "T1", "T3"], "evidenceRefs": ["docs/engineering/SAVE_RECOVERY_ADR.md", "docs/engineering/TECHNICAL_DESIGN.md"], "fixtureGroup": "p0.file.document-lifecycle.v1", "evidenceStatus": "OPEN" },
    "INF-P0-MARKDOWN-001": { "requirementKind": "FEATURE", "productPhase": "P0", "owner": "Core.MarkdownPipeline", "engineeringPhases": ["T0", "T1", "T2"], "evidenceRefs": ["docs/engineering/MARKDOWN_DIALECT_MANIFEST.md", "docs/engineering/RENDER_MANIFEST.md"], "fixtureGroup": "p0.markdown.baseline.v1", "evidenceStatus": "OPEN" },
    "INF-P0-MODE-001": { "requirementKind": "FEATURE", "productPhase": "P0", "owner": "Core.WindowModes", "engineeringPhases": ["T1", "T2", "T3"], "evidenceRefs": ["docs/engineering/SETTINGS_SCHEMA.json", "docs/engineering/TECHNICAL_DESIGN.md"], "fixtureGroup": "p0.mode.window-modes.v1", "evidenceStatus": "OPEN" },
    "INF-P0-NAV-001": { "requirementKind": "FEATURE", "productPhase": "P0", "owner": "Core.Navigation", "engineeringPhases": ["T0", "T2", "T3"], "evidenceRefs": ["docs/engineering/SANITIZER_MANIFEST.md", "docs/engineering/TECHNICAL_DESIGN.md"], "fixtureGroup": "p0.nav.source-links.v1", "evidenceStatus": "OPEN" },